{
  "schemaVersion": 2,
  "name": "workbench-import-review",
  "catalog": {
    "package": "agentic-awesome-skills",
    "version": "16.7.0",
    "integrity": "sha256-1e464d8b3053b349fc16ba5a0f23a7aa4042802362a5a97604b9675846a22e27"
  },
  "targets": [
    {
      "host": "codex",
      "scope": "project"
    }
  ],
  "profile": {
    "goals": [
      "Verify Workbench import boundaries, artifact bindings and accessible error states"
    ],
    "projectType": "web-app",
    "languages": [
      "TypeScript"
    ],
    "frameworks": [
      "React",
      "Vite",
      "Vitest"
    ],
    "constraints": [
      "Local review only; no project uploads, installation or deployment"
    ]
  },
  "skills": [
    {
      "id": "react-patterns"
    },
    {
      "id": "typescript-pro"
    },
    {
      "id": "invariant-guard"
    },
    {
      "id": "vitest-skill"
    },
    {
      "id": "privacy-by-design"
    },
    {
      "id": "fixing-accessibility"
    },
    {
      "id": "antigravity-maintainer-batch-release"
    }
  ]
}
