{
  "schemaVersion": 2,
  "name": "AAS MCP contract review",
  "catalog": {
    "package": "agentic-awesome-skills",
    "version": "16.7.0",
    "integrity": "sha256-1e464d8b3053b349fc16ba5a0f23a7aa4042802362a5a97604b9675846a22e27"
  },
  "targets": [
    {
      "host": "codex",
      "scope": "project"
    }
  ],
  "profile": {
    "goals": [
      "review-mcp-contract"
    ],
    "projectType": "Local read-only Node MCP catalog",
    "languages": [
      "javascript"
    ],
    "frameworks": [
      "node"
    ],
    "constraints": [
      "offline runtime",
      "bounded inputs",
      "agent-owned selection",
      "no release or installation"
    ]
  },
  "skills": [
    {
      "id": "mcp-builder"
    },
    {
      "id": "javascript-pro"
    },
    {
      "id": "invariant-guard"
    },
    {
      "id": "cross-platform-contract-propagation-audit"
    },
    {
      "id": "javascript-testing-patterns"
    },
    {
      "id": "privacy-by-design"
    },
    {
      "id": "antigravity-maintainer-batch-release"
    }
  ]
}
